{
  "topic": "Movimiento suave para cuidar las articulaciones despues de los 45",
  "angle": "Ejercicios cotidianos de bajo impacto con enfoque educativo y prudente",
  "target_duration_sec": 54,
  "key_points": [
    "calentar con respiracion y pasos lentos",
    "mover hombros y cuello sin forzar",
    "caminar en casa o en un parque cercano",
    "escuchar el cuerpo y descansar si hay dolor",
    "consultar a un profesional si hay molestias persistentes"
  ],
  "title_seed": "5 movimientos suaves para cuidar tus articulaciones despues de los 45"
}
