{
  "topic": "Desayuno equilibrado para tener energia despues de los 45",
  "angle": "Ideas practicas de comida sencilla sin prometer efectos medicos",
  "target_duration_sec": 54,
  "key_points": [
    "incluir proteina suave como huevo o yogur",
    "sumar fruta o avena para mayor saciedad",
    "tomar agua antes del cafe",
    "evitar exceso de azucar al empezar el dia",
    "adaptar porciones segun hambre y actividad"
  ],
  "title_seed": "Desayuno equilibrado para tener energia despues de los 45"
}
