{
  "topic": "Habitos nocturnos para dormir mejor despues de los 45",
  "angle": "Rutina simple, segura y realista para mejorar el descanso sin promesas medicas",
  "target_duration_sec": 54,
  "key_points": [
    "preparar una hora tranquila antes de dormir",
    "evitar cenas muy pesadas y pantallas brillantes",
    "usar respiracion suave para bajar el ritmo",
    "mantener horarios constantes",
    "consultar a un profesional si el insomnio persiste"
  ],
  "title_seed": "5 habitos nocturnos para dormir mejor despues de los 45"
}
