{
  "topic": "Caminar cada dia sin cansarse demasiado despues de los 45",
  "angle": "Consejos prudentes para crear una caminata sostenible y de bajo impacto",
  "target_duration_sec": 54,
  "key_points": [
    "empezar con diez minutos a ritmo comodo",
    "usar zapatos estables y ropa ligera",
    "elegir rutas seguras y con sombra",
    "descansar si aparece dolor o mareo",
    "aumentar el tiempo poco a poco cada semana"
  ],
  "title_seed": "Como caminar cada dia sin cansarte demasiado despues de los 45"
}
