{
  "topic": "Cena ligera para descansar mejor despues de los 45",
  "angle": "Ideas practicas para una noche mas tranquila sin dietas extremas",
  "target_duration_sec": 54,
  "key_points": [
    "cenar con tiempo antes de acostarse",
    "elegir porciones moderadas y alimentos sencillos",
    "evitar exceso de cafeina por la tarde",
    "preparar la cocina para una manana mas facil",
    "pedir orientacion profesional si hay problemas digestivos frecuentes"
  ],
  "title_seed": "5 ideas de cena ligera para dormir mejor despues de los 45"
}
