{
  "topic": "Rutina nocturna completa para dormir mejor despues de los 45",
  "angle": "Guia profunda de habitos nocturnos seguros, realistas y sostenibles para mejorar el descanso despues de los 45 sin promesas medicas",
  "target_duration_sec": 1500,
  "key_points": [
    "por que el sueno cambia despues de los 45 (cambios hormonales y de estilo de vida)",
    "preparar una hora tranquila antes de dormir (rituales y ambiente)",
    "cena ligera y horario de comida: que evitar y que preferir",
    "manejo de pantallas y luz azul al atardecer",
    "tecnicas de respiracion suave y meditacion corta para bajar el ritmo",
    "estiramientos suaves y movimiento ligero antes de dormir",
    "rutina constante de horarios y como entrenar al cuerpo",
    "manejo del estres mental y pensamientos antes de dormir",
    "uso adecuado de la cama: solo para dormir y descansar",
    "que hacer cuando te despiertas a media noche",
    "cuando consultar a un profesional de salud (signos de alerta)",
    "errores comunes despues de los 45 que arruinan el descanso"
  ],
  "title_seed": "Rutina nocturna completa para dormir mejor despues de los 45 anos"
}
