{
  "topic": "Rutina matutina suave para tener mas energia despues de los 45",
  "angle": "Habitos simples y seguros para empezar el dia con calma sin promesas medicas",
  "target_duration_sec": 54,
  "key_points": [
    "abrir las cortinas y recibir luz natural",
    "beber agua antes del cafe",
    "hacer movimientos suaves por cinco minutos",
    "desayunar algo ligero y nutritivo",
    "mantener una rutina realista todos los dias"
  ],
  "title_seed": "5 habitos matutinos para tener mas energia despues de los 45"
}
