{
  "topic": "Como recordar tomar agua durante el dia despues de los 45",
  "angle": "Recordatorios cotidianos para hidratarse sin reglas extremas",
  "target_duration_sec": 54,
  "key_points": [
    "dejar una botella visible en la cocina",
    "tomar pequenos sorbos al levantarse",
    "acompanar comidas con agua simple",
    "observar color de orina como senal general",
    "pedir orientacion medica si hay restricciones de liquidos"
  ],
  "title_seed": "Como recordar tomar agua durante el dia despues de los 45"
}
