{
  "topic": "Habitos nocturnos para dormir mejor despues de los 45",
  "angle": "Rutina simple y realista para preparar el cuerpo antes de acostarse",
  "target_duration_sec": 54,
  "key_points": [
    "bajar la luz de la casa una hora antes",
    "evitar cenas pesadas y pantallas intensas",
    "hacer respiracion lenta sentado en la cama",
    "mantener un horario parecido cada noche",
    "consultar a un profesional si el insomnio persiste"
  ],
  "title_seed": "5 habitos nocturnos para dormir mejor despues de los 45"
}
